Condition;Drug;Effectiveness
Induction of Cervical Softening and Dilation in Labor;cytotec;3.916666667
Induction of Ovarian Follicle Maturation;ovidrel syringe;4.5
Infected Conjunctiva by Chlamydia Trachomatis Bacteria;doxycycline hyclate vial;3
infection;metronidazole;5
Infection Around a Tooth;flagyl;3.818181818
infection caused by a virus;acyclovir cream;5
infection caused by bacteria;augmentin;5
Infection caused by Bacteroides Fragilis Bacteria;metronidazole;4.333333333
Infection caused by Blastomyces Dermatitidis Fungus;sporanox;5
Infection caused by Coccidioides Fungus;amphotericin b vial;4.666666667
Infection caused by Leptospira Bacteria;doxycycline calcium syrup;4
Infection caused by Microsporida Parasite;albendazole;4
Infection caused by Pseudomonas Aeruginosa Bacteria;colistimethate vial;5
Infection caused by Rickettsiae Bacteria;doxycycline ir-dr;5
Infection caused by the Bacteria Anaerobes;metronidazole;4.6
Infection caused by the Bacteria Ehrlichia;doxycycline calcium syrup;3
Infection caused by the Bacteria Listeria Monocytogenes;erythromycin;5
Infection caused by the Bacteria Streptococcus;lincocin vial;5
Infection caused by the Fungus Scedosporium Apiospermum;sporanox;2
Infection caused by the Parasite Balantidium;flagyl;4.333333333
Infection caused by the Trichinae Parasite;albenza;3
Infection caused by the Worm Toxocara Canis;albenza;3
Infection caused by Trichomoniasis Protozoa;flagyl;4.153846154
Infection caused by Worms - Metagonimiasis;praziquantel tablet;4
Infection caused by Yersinia Pseudotuberculosis Bacteria;ceftriaxone vial with threaded port;3
Infection Confined to the Surface of the Eye;bacitracin 500 unit/gram eye ointment;5
Infection due to a Brucella Bacteria;rifampin;5
Infection due to Chlamydiae Species Bacteria;doxycycline calcium syrup;3
Infection due to Rickettsia Prowazekii Bacteria;doxycycline hyclate tablet tetracyclines;1
Infection due to Salmonella paratyphi Bacteria;bactrim ds;5
Infection due to the Bacteria Rickettsia;doxycycline hyclate vial;5
Infection due to the Candida Fungus;amphotericin b vial;1
Infection due to the Microorganism Chlamydia Psittaci;doxycycline hyclate tablet tetracyclines;5
Infection due to the Microorganism Coxiella Burnetii;doxycycline hyclate tablet tetracyclines;3
Infection due to the Parasite Toxoplasma Gondii;daraprim;4.5
Infection due to unusual Mycobacteria;monodox;5
Infection due to Vancomycin-Resistant Enterococcus Faecium;zyvox;4.25
Infection Following Vaginal Cuff Surgery;flagyl;3
Infection From Birth due to Toxoplasma Gondii Parasite;sulfadiazine;1
Infection Occurring During or Soon After an Operation;vancomycin hcl-0.9 nacl solution, piggyback premix frozen;4.5
Infection of a Joint;clindamycin phosphate-d5w solution, intravenous piggyback;5
Infection of a Joint caused by Staphylococcus Aureus;ceftriaxone vial with threaded port;5
Infection of a Joint caused by Streptococcus Bacteria;ceftriaxone vial with threaded port;3
Infection of a Woman\s Reproductive Organs';metronidazole;3.5
Infection of Abdominal Cavity Lining due to Bacteroides;flagyl;3
Infection of Abdominal Cavity Lining due to Clostridium;flagyl;4
Infection of an Artificial Heart Valve;vancomycin hcl-0.9 nacl solution, piggyback premix frozen;3
Infection of Artificial Heart Valve due to Staphylococcus;oxacillin sodium vial with threaded port;1
Infection of Bone;metronidazole;5
Infection of Cornea and Conjunctiva due to Herpes Simplex;trifluridine drops;5
Infection of Female Pelvic Organs caused by Klebsiella;azactam vial;3
Infection of Genitals or Urinary Tract;amoxicillin;4
Infection of Genitals or Urinary Tract due to Enterococcus;amoxicillin;4.5
Infection of Genitals or Urinary Tract due to Proteus;amoxicillin;3
Infection of Intestines caused by Staphylococcal Bacteria;vancomycin 50 mg/ml oral solution pseudomembranous colitis agents;3.235294118
Infection of Lining of the Uterus caused by Bacteroides;flagyl;4
Infection of the Bladder;cipro xr;3
Infection of the Brain or Spinal Cord caused by Anthrax;vancomycin hcl-0.9 nacl solution, piggyback premix frozen;4
Infection of the Cornea of the Eye due to Herpes Simplex;trifluridine drops;4.2
Infection of the Cornea of the Eye due to Herpes Zoster;zylet suspension, drops (final dose form);5
Infection of the Cornea of the Eye with Ulcer Formation;ganciclovir gel;4
Infection of the Genital and Urinary Tract due to E. Coli;amoxicillin;3
Infection of the Lining of the Eye caused by a Fungus;natacyn suspension, drops (final dose form);1
Infection of the Middle Ear by H. Influenzae Bacteria;ampicillin trihydrate;5
Infection of the Middle Ear by S. Pneumoniae Bacteria;azithromycin;4
Infection of the Middle Ear caused by Staphylococcus;keflex;5
Infection of the Middle Ear caused by Streptococcus;amoxicillin-clavulanate pot er;5
Infection of the Prostate Gland caused by E. Coli;ciprofloxacin;3.2
Infection of the Prostate Gland caused by Klebsiella;keflex;2
Infection of the Prostate Gland caused by Proteus;cephalexin;5
Infection of the Skin caused by Staphylococcus Aureus;mupirocin cream;5
Infection of the Throat caused by Staphylococcus Bacteria;amoxicillin;2.777777778
Infection of the Tonsils caused by Staphylococcus Bacteria;amoxicillin;3
Infection of the Urethra caused by Chlamydia Trachomatis;azithromycin;3
Infection of the Urinary Tract caused by Enterococcus;ciprofloxacin;5
Infection of the Urinary Tract caused by Proteus Bacteria;cefadroxil;5
Infection of Tissues of the Uterus caused by Bacteroides;clindamycin hcl;3
Infection of Urinary Tract due to Enterobacter Cloacae;amoxicillin-clavulanate pot er;4
Infection of Urinary Tract due to Providencia Species;cipro;4
Infection of Urinary Tract due to Pseudomonas Aeruginosa;cipro;3
Infection of Urinary Tract with Complications;merrem vial;5
Infection Prevention from Tooth Extraction;penicillin v potassium;3.178571429
Infection that causes Diarrhea - Giardiasis;tindamax;4.666666667
Infection with Cryptococcus Fungus;amphotericin b lipid complex suspension;5
Infection Within the Abdomen;clindamycin pediatric;5
Infection Within the Abdomen caused by Clostridium Bacteria;metronidazole;3.2
Infectious Diarrhea;ciprofloxacin;4
Infectious Disease with Relapsing Attacks of High Fever;minocycline hcl;5
Infertility associated with the Lack of Ovulation;follistim aq cartridge;5
Infertility caused by Deficiency of a Hormone-Progesterone;progesterone micronized 4  vaginal gel;5
Infestation by Roundworms;pyrantel pamoate suspension;2
Infiltration of White Blood Cells into the Lungs;prednisone;4.2
Inflammation  Obstruction of Smallest Breathing Passages;prednisone;3.6
Inflammation and Infection of Nail Cuticle;fungoid tincture 2  topical;5
Inflammation and Infection of the Abdomen Lining;avelox;4
Inflammation and Rotation of the Testes;testopel pellet;5
Inflammation in Lungs caused by Allergic Reaction;prednisolone;5
Inflammation in Pelvic Area caused by Anaerobic Bacteria;clindamycin hcl;4.5
Inflammation of a Hair Follicle;centany ointment;5
Inflammation of a Shoulder Joint;indomethacin suppository;3.666666667
Inflammation of Blood Vessels in the Skin;hydroxychloroquine sulfate;3.5
Inflammation of Blood Vessels with Rheumatoid Arthritis;depen;5
Inflammation of Cornea and Conjunctiva Occurring in Spring;alomide drops;4
Inflammation of Cornea due to Improper Closing of the Eye;tobrex drops;1
Inflammation of Esophagus from Backflow of Stomach Acid;pepcid;5
Inflammation of Eyelid Edges and the Lining of the Eye;bacitracin 500 unit/gram eye ointment;5
Inflammation of Lips due to Sunlight Exposure;efudex cream;4
Inflammation of Lung from Inhaling Something Irritating;kenalog-40 vial;5
Inflammation of Mucous Membranes due to Radiation Therapy;gelclair gel in packet;4
Inflammation of Multiple Voluntary Muscles;octagam vial;4
Inflammation of One of the Glands of the Eyelids;erythromycin ointment;1
Inflammation of Several Cartilages of the Body;dapsone;5
Inflammation of Skin and Muscles All Over the Body;depo-medrol vial;5
Inflammation of Skin caused by an Allergy;anti-itch (hydrocortisone) 1  topical cream;5
Inflammation of the Artery in the Temple Area;dexamethasone intensol;5
Inflammation of the Bladder;cipro;3.5
Inflammation of the Brain caused by Herpes Simplex Virus;acyclovir sodium vial;5
Inflammation of the Choroid and Retina of the Eye;sulfadiazine;2
Inflammation of the Conjunctiva Occurring in the Spring;alomide drops;3
Inflammation of the Cornea due to Exposure to the Air;tobradex ointment;4
Inflammation of the Cornea of the Eye due to Bacteria;ofloxacin drops;5
Inflammation of the Covering of the Heart or Pericardium;methylprednisolone;4.5
Inflammation of the Covering of the Tendon;indomethacin;5
Inflammation of the Elbow and Surrounding Tissue;methylprednisolone;3.444444444
Inflammation of the Esophagus with Erosion;nexium;5
Inflammation of the External Ear Resembling Eczema;dermotic drops;4.769230769
Inflammation of the Eye;fluorometholone acetate drops, suspension;5
Inflammation of the Eye Following Surgery;diclofenac sodium drops;5
Inflammation of the Front Portion of the Eye;durezol drops;5
Inflammation of the Gums;dentagel gel;5
Inflammation of the Gums and Mouth;tetracycline hcl;5
Inflammation of the Heart;methylprednisolone;5
Inflammation of the Iris - the Colored Part of the Eyeball;pred forte suspension, drops (final dose form);5
Inflammation of the Iris and Ciliary Body of the Eye;pred forte suspension, drops (final dose form);5
Inflammation of the Joints due to Gout;depo-medrol vial;5
Inflammation of the Lining of a Joint;medrol;5
Inflammation of the Mucous Membrane due to Cancer Chemotherapy;caphosol solution;2
Inflammation of the Nose;40pse-400gfn-20dm;5
Inflammation of the Nose due to an Allergy;allergy relief (cetirizine) 10 mg tablet;5
Inflammation of the Outer Ear due to Allergy;fluorometholone ointment;3
Inflammation of the Rectum;calmol 4 suppository, rectal;5
Inflammation of the Sac in which Tears are Collected;tobramycin-dexamethasone ointment;5
Inflammation of the Sac Surrounding the Joint - Bursitis;magnesium salicylate tablet;5
Inflammation of the Sigmoid Colon and the Rectum;mesalamine enema;3.777777778
Inflammation of the Stomach Lining caused by H. Pylori;aciphex;5
Inflammation of the Tendon;magnesium salicylate tablet;5
Inflammation of the Tissues Surrounding a Tooth;arestin 1 mg dental cartridge tetracyclines;2.388888889
Inflammation of the Tonsils;cefadroxil;5
Inflammation of the Urethra Not due to Gonorrhea;zithromax packet macrolide antibiotics;5
Inflammation of the Uvea of the Eye;pred forte suspension, drops (final dose form);5
Inflammation of the Vagina caused by Bacteria;clindamycin hcl;3.285714286
Inflammation of Uvea of Eye that is Resistant to Treatment;cellcept;3.5
Inflammation of Uvea of the Eye not caused by Infection;ozurdex implant;5
Inflammation with Fibrous Tissue Formation of Bile Ducts;urso forte;3
Inflammatory Bowel Disease;gastrocrom;5
Influenza A Prevention;flumadine;5
Influenza Prevention;fluzone high-dose 2018-2019 syringe;5
Inherited Disorder of Continuing Episodes of Swelling;cinryze vial;5
Inherited Periodic Paralysis;acetazolamide;3
Injection to cause Local Loss of Feeling or Numbness;mepivacaine 30 mg/ml (3 ) injection dental cartridge local anesthetics - parenteral;4
Insect Bites;caladryl lotion;5
Insertion of a Tube Into the Intestine or Stomach;reglan;2.5
insomnia associated with depression;trazodone hcl;3.142857143
Insomnia with Middle of the Night Awakening and 4 Hours Sleep Time Remaining;edluar tablet, sublingual;5
Insulin-like Growth Factor Disorder;increlex vial;4
Intestinal Infection by a Worm - Trichuris Trichiura;mebendazole tablet, chewable;4
Intestinal Infection caused by the Roundworm Strongyloides;stromectol;4.25
Intestinal Infection due to Campylobacter;azithromycin;1
Intestinal Parasitic Infection;paromomycin sulfate;4
Intestine Infection due to the Shigella Bacteria;sulfamethoxazole-trimethoprim;5
Intraductal Breast Cancer;tamoxifen citrate;3.090909091
Involuntary Quivering;ativan;4.75
Iodine Deficiency;lugol\s';5
Irregular Heart Rhythm due to the Drug Digitalis;phenytoin;3
Irregular Involuntary Spasms of Limbs or Facial Muscles with Huntington\s Disease';austedo;5
Irritable Bowel Syndrome with Constipation;zelnorm 6 mg tablet irritable bowel syndrome agents;5
Irritable Colon;acidophilus probiotic;5
Itching;alavert tablet,disintegrating;5
Itching Associated with Blockage of a Bile Duct;colestid;5
Itching of the Ear;cortane-b lotion;1
Joint Capsule Membrane Inflammation of a Diseased Joint;decadron tablet;5
Joint Damage causing Pain and Loss of Function;acetaminophen tablet;5
Joint Disease which may include Attacks of Acute Arthritis;betamethasone acetate-sod phos vial;5
Joint Infection caused by Enterobacter Species Bacteria;cipro;4
Joint Infection caused by Pseudomonas Aeruginosa Bacteria;cipro;3
Joint Inflammatory Disease in Children and Young Adults;celecoxib;5
Joint Pain;buffered aspirin;5
Kidney Disease from Diabetes;valsartan;5
Kidney Problem caused by Body Tissue Disease-Scleroderma;enalapril maleate;4
Kidney Stones caused by Cystine;tricitrates;4.5
Labor Pain;demerol vial;5
Lack in Minerals;a thru z tablet;5
Lack in Vitamins;abc plus;5
Late Onset Asthma;advair hfa aerosol with adapter;5
Lead Poisoning;chemet;2.25
Leg Pain when Walking;;
Lennox-Gastaut Syndrome Treatment Adjunct;onfi;4.6
Lentigo on the Skin of Face;avage cream;4
Leprosy;dapsone;5
Lesions in the Bone of the Disease Multiple Myeloma;zometa vial;3.8125
Life Threatening Allergic Reaction;diphenhydramine hcl;5
Life-Threatening Rapid Ventricular Heartbeat;betapace;5
Liver Cell Cancer;nexavar;2.578947368
Liver Inflammation caused by Body\s Own Immune Response';azathioprine sodium vial;5
Liver Problems;prednisolone;5
Liver Tissue Death;kenalog-40 vial;3
Local Anesthesia for Surgical or Other Procedure;marcaine vial;5
Local Anesthesia for Urethral Pain;lidocaine 2  mucosal solution;5
Local Anesthesia Injected in Subarachnoid Space of Spine;marcaine spinal ampul;4.2
Local Anesthesia Injected to Block Nerve Transmission;carbocaine 2  injection solution;4.5
Locally Advanced Breast Carcinoma;paclitaxel vial;5
Loss of Appetite;cyproheptadine hcl;3.862068966
Loss of Appetite with HIV;megace es;5
Lou Gehrig\s Disease';rilutek;2.705882353
Low Amount of Albumin Proteins in the Blood;albumin (human) solution, intravenous;5
Low Amount of Calcium in the Blood;actical;5
Low Amount of Magnesium in the Blood;maginex;5
Low Amount of Phosphate in the Blood;k-phos original;5
Low Amount of Potassium in the Blood;klor-con-ef;5
Low Amount of Sodium in the Blood;sodium chloride 1 gram tablet (oral supplement);5
Low Blood Calcium in Person with Hypoparathyroidism;natpara cartridge;2.333333333
Low Blood Pressure caused by Spinal Anesthesia;ephedrine sulfate syringe;1
Low Blood Sugar;diazoxide suspension;5
Low Energy;no doz;5
Low Estrogen After Operation to Remove Ovaries;estradiol cypionate oil;5
Low HDL Cholesterol;fenofibrate;4
Low Platelet Count and Bleeding from Immune Response;dexamethasone;4
Low Platelet Count in Chronic Hepatitis C Infection;promacta;3
Low Red Blood Count due to Uterine Fibroids;lupron depot-ped kit;5
Low Sperm Count;follitropin alfa 450 unit subcutaneous solution;5
Lower Respiratory Tract Infection;ceftin suspension, reconstituted;5
Lung Fibrosis;prednisone;3.833333333
Lung Infection caused by Coccidioides Fungus;fluconazole-nacl solution, intravenous piggyback;4
Lyme Disease;ceftriaxone solution, intravenous piggyback;5
Lyme Disease of the Central Nervous System;ceftriaxone vial with threaded port;5
Lymph Node Positive Colon Cancer;oxaliplatin vial;4
Lymphangioleiomyomatosis;rapamune;4.5
Lymphoma Spread to Brain  Spinal Cord Lining;depocyt vial;5
Macular Edema;lucentis vial;4
Maintain Patency of Indwelling Vascular Catheter;heparin (porcine) 6,000 unit/1,000 ml(6 unit/ml) in 0.9  nacl iv soln;3
Maintain the Patency of Ductus Arteriosus;caverject vial;5
Major Depressive Disorder;brexpiprazole tablet;5
Major Nerve Block for Surgery;marcaine 0.25  (2.5 mg/ml) injection solution;4.333333333
Malaria;doxycycline hyclate tablet tetracyclines;5
Malaria caused by the Protozoa Plasmodium Falciparum;artemether-lumefantrine tablet;5
Malaria caused by the Protozoa Plasmodium Vivax;plaquenil;4
Malaria Prevention;chloroquine phosphate;5
Male Infertility;clomiphene citrate;3
Male Pattern Baldness;propecia tablet;4.25
Male Pattern of Hair Distribution or Hirsutism in a Woman;spironolactone;3
Malignant Brain Tumor Glioblastoma;lomustine capsule;5
Malignant Hyperthermia;dantrolene 20 mg intravenous solution central muscle relaxants;3.5
Malignant Melanoma with BRAF V600E Mutation;zelboraf;2.75
Malignant Melanoma with BRAF V600K Mutation;mekinist;3
Malignant Testicular Tumor - Seminoma;carboplatin vial;5
Malignant Tumor of the Kidney;cyclophosphamide;3
malignant tumor or cancer;folotyn vial;5
Management of Body\s Rejection to a Transplanted Kidney';thymoglobulin vial;5
Mania associated with Bipolar Disorder;geodon vial;5
Mania associated with Bipolar Disorder, Adjunct Treatment;lorazepam;4.090909091
Manic-Depression;carbamazepine;5
Mantle Cell Lymphoma;bendamustine hcl vial;5
Marked Inflammation of Urethra, the Canal that leads From the Bladder;estring ring, vaginal;5
Medication to Aid Study of the Blood Flow in the Heart;myoview vial;5
Medication Treatment for Healing Erosive Esophagitis;nexium i.v. vial;5
Medication Treatment for Healing Gastroesophageal Reflux;aciphex;4.175438596
Medication Treatment for Healing Stomach Ulcer;ranitidine hcl;4.5
Medication Treatment for Healing Ulcer of the Duodenum;dexilant;5
Medullary Thyroid Cancer;cabozantinib tablet;3.5
Meningococcal Vaccination;menactra vial;5
Mental Disorder with Loss of Normal Personality  Reality;carbamazepine;5
Metabolic Process Which Breaks Down Substances in the Body;oxandrin;5
Metastatic Anal Cancer;fluorouracil vial;3
Metastatic Breast Cancer Progression Post-Antiestrogen Therapy;faslodex syringe;3.984126984
Metastatic Cancer Involving the Kidney Cells;proleukin vial;1
Metastatic Cancer of Cervix;topotecan hcl vial;5
Metastatic Castration-Resistant Prostate Cancer;abiraterone acetate;5
Metastatic Endometrial Carcinoma;megestrol acetate;5
Metastatic Malignant Melanoma;keytruda vial;4.8
Methemoglobinemia;methylene blue vial;5
Methicillin-Resistant Staphylococcus Aureus Bacteria in Nose;centany ointment;5
Method of X-Raying the Spinal Canal Using Dye;omnipaque 350 mg iodine/ml intravenous solution;5
Middle Ear Infection;penicillin v potassium;5
Middle Ear Infection caused by Moraxella Catarrhalis;azithromycin;2
Middle Ear Infection Needing Tube Placed in Ear;ciprodex suspension, drops (final dose form);2.566666667
Migraine Headache;all day pain relief;5
Migraine Prevention;inderal xl;5
Mild Pain associated with Arthritis;excedrin extra strength;5
Mild to Moderate Alzheimer\s Type Dementia';galantamine hbr;3.666666667
Mild Underactive Thyroid;cytomel;3.25
Minor Musculoskeletal Injury;naproxen;2.5
Minor Skin Infection caused by Bacteria;bacitracin ointment;5
Minor Skin Wound Pain;neosporin + pain relief cream;5
Mitral Valve Prolapse Syndrome;corgard;5
Moderate to Severe Alzheimer\s Type Dementia';memantine capsule, sprinkle, extended release 24 hr dose pack (capsule, sprinkle ext rel 24hr pack);3.6
Moderate to Severe Plaque Psoriasis;apremilast tablet;5
Motion Sickness;bonine;5
Mouth Infection Prevention;paroex mouthwash;5
Mouth Irritation;benzodent cream;5
MRI Scan;omniscan vial;5
Mucous Membrane White Spots or Patches;efudex cream;5
Multifocal Motor Neuropathy;gammagard liquid vial;5
Multiple Drugs for Skin Infection due to Pseudomonas Aeruginosa Bacteria;gentamicin sulfate vial with threaded port;3
Multiple Myeloma;carfilzomib solution, reconstituted (recon soln);5
Multiple Polyps in the Colon;celebrex;5
Multiple Sclerosis;prednisone intensol;5
Multiple Sclerosis Symptoms Return then Become Less Severe;avonex syringe kit;5
Multiple Seizure Types;acetazolamide;5
Muscle or Bone Disorder;dexpak;5
Muscle Pain;pamprin multi-symptom;5
Muscle Pain and Stiffness in Shoulder, Neck and Pelvis;celestone vial;5
Muscle Spasm;dantrolene sodium;5
Muscle Spasms caused by a Spinal Disease;dantrium;5
Muscle Spasms due to a Brain Disease;lioresal intrathecal ampul;5
Muscle Weakness associated with Sleeping Disease;sodium oxybate solution;4.6
Myasthenia Gravis;deltasone;5
Mycobacterium Avium Bacteria Infection;azithromycin;3
Myelodysplastic Syndrome with 5q Deletion Gene Type;revlimid;1
Myelofibrosis;ruxolitinib tablet;4.666666667
Myocardial Reinfarction Prevention;clopidogrel;5
Myotonia Congenita;testopel pellet;1
Myxedema Coma;levothyroxine 500 mcg intravenous powder for solution thyroid hormones;5
Narcotic Addiction;buprenorphine 2.1 mg-naloxone 0.3 mg buccal film;5
Nausea and Vomiting;benadryl;5
Nausea and Vomiting After Surgery;droperidol ampul;3
Nausea and Vomiting caused by Cancer Drugs;aloxi vial;5
Nausea and Vomiting of Pregnancy;diclegis;4.341463415
Needing to Urinate Immediately;oxybutynin patch, transdermal semiweekly;5
Nephrotic Syndrome;cortisone acetate;4
Nerve Damage caused by Hydrazine Poisoning;pyridoxine hcl;3
Nerve Pain;maprotiline hcl;4
Nerve Pain after Herpes;lidocaine adhesive patch, medicated topical local anesthetics;5
Nerve Pain from Spinal Cord Injury;lyrica;3.362637363
Nerve Pain of Tongue and Throat from 9th Cranial Nerve;carbamazepine;4
Neuroendocrine Cancer of the Prostate Gland;prednisone;2
Neuroleptic Malignant Syndrome;cycloset;5
Neuropathic Pain;conzip;5
neurotrophic keratitis;oxervate drops;2
Neutrophils Decreased by Medication;filgrastim solution;2
Nicotine Addiction;nicorette gum;5
Non-24 Hour Sleep-Wake Cycle Disorder;hetlioz;1
Non-Contagious Disease due to Actinomyces Bacteria;cleocin hcl;5
Nondiabetic Proteinuric Nephropathy;atacand;4
Non-Hodgkin\s Lymphoma';adriamycin 2 mg/ml intravenous solution;5
non-metastatic castration-resistant prostate cancer;erleada tablet;5
Non-Q Wave Heart Attack;plavix;5
Non-Radiographic Axial Spondyloarthritis;meloxicam;4
Non-Seasonal Allergic Runny Nose;alavert;5
Non-Small Cell Lung Cancer;bevacizumab solution;5
Non-Small Cell Lung Cancer with EGFR T790M Gene Mutation;tagrisso;4.2
Nonsquamous Non-Small Cell Lung Cancer;keytruda vial;3
Obsessive Compulsive Disorder;sarafem;4.5
Obstruction of a Blood Vessel by a Blood Clot;low dose aspirin ec;5
Obstructive Pulmonary Disease;kenalog-40 vial;5
Occasional Numbness, Prickling, or Tingling of Fingers and Toes;procardia xl;3.75
Oily Skin;liquimat lotion;5
Opiate Pain Medication causing Severe Constipation;relistor;4
Ornithine Carbamoyltransferase Deficiency;sodium phenylbutyrate 0.94 gram/gram oral powder;5
Osteoarthritis and High Risk of Developing Gastric Ulcers;duexis;5
Osteoarthritis of the Knee;hymovis syringe;5
Osteoporosis;actical;5
Osteoporosis caused by Anti-Androgen Drugs;zometa vial;3.25
Osteoporosis caused by Glucocorticoid Drugs;reclast bottle, infusion;3.428571429
Osteoporosis in Male Patient;forteo pen injector;3.333333333
Osteoporosis in Men due to Deficient Function of Testis;fosamax plus d;5
osteoporosis in postmenopausal woman at high risk for fracture;reclast bottle, infusion;4.5
Osteosarcoma of Bone;doxorubicin hcl vial;4
Osteosarcoma that has Not Spread Outside the Bone;methotrexate sodium vial;2.5
Other;a thru z select;5
Outer Ear Inflammation caused by Allergy or Infection;hydrocortisone-acetic acid drops;5
Ovarian Dysfunction causing Absence of Menstrual Periods;progesterone micronized 4  vaginal gel;1
Ovarian Germ Cell Cancer;cisplatin vial;5
Ovary Follicle Stimulation for Assisted Fertility Procedures;follistim aq cartridge;5
Over Excitement;haldol ampul;1
Overactive Bladder;mirabegron tablet, extended release 24 hr;4.5
Overactive Thyroid causing Life-Threatening Symptoms;inderal la;5
Overactive Thyroid Gland;propylthiouracil;3.336842105
Overactive Thyroid Gland in Newborn;propylthiouracil;4
Overdose of Organophosphorous Agent;pralidoxime solution, reconstituted (recon soln);4
Overdose of the Drug Acetaminophen;acetadote vial;5
Overweight;desoxyn;5
Paget\s Disease of Bone';pamidronate disodium vial;5
Pain;acetaminophen-diphenhydramine;5
Pain associated with Arthritis;acetaminophen suppository, rectal;5
Pain In a Cancer Patient When On Pain Medication;fentanyl 600 mcg buccal tablet, effervescent opioid analgesics- ir (with all antitussive opiates);5
Pain Originating From a Nerve;neurontin;3.333992095
Pain with Advanced Prostate Cancer Resistant to Hormones;mitoxantrone hcl vial;4
Painful Periods;aranelle;5
Painful Sexual Intercourse due to Menopause;ospemifene tablet;4.5
Painful, Red or Swollen Mouth;triamcinolone acetonide paste;5
Pancreas Organ Failure;viokace;4
Pancreatic Tumor causing Excessive Secretion of Insulin;sandostatin lar kit;5
Panic Disorder;alprazolam intensol;5
Parkinson Symptoms;carbidopa;4.4
Parkinson\s Disease';gocovri;5
Parkinsonism due to Degenerations in the Brain;carbidopa;5
Parkinsonism due to Thickening of Blood Vessel Walls;benztropine mesylate;3
Paroxysmal Atrial Fibrillation;flecainide acetate;4.428571429
Paroxysmal Supraventricular Tachycardia;amiodarone hcl-d5w plastic bag, injection;5
PCP Prophylaxis;daraprim;5
PD-L1 positive adenocarcinoma of gastroesophageal junction;keytruda vial;5
PD-L1 Positive Non-Small Cell Lung Cancer;keytruda vial;1
Pediatric Fever without a Source;amoxicillin;3
Pelvic Inflammatory Disease;azithromycin;5
pemphigus vulgaris;rituxan vial;4.666666667
Peptic Ulcer due to Bacteria Helicobacter Pylori;flagyl;3.666666667
Periarteritis Nodosa;prednisone;2
Peripheral T-cell Lymphoma;folotyn vial;5
Peripheral Vascular Disease;pentoxifylline;3.392857143
Persistent Hives of Unknown Cause;fexofenadine hcl;5
Pervasive Developmental Disorder;invega;3.666666667
Petit Mal Epilepsy with Multiple Seizure Types;depakote er;4
Petit Mal Seizures;celontin;5
Peyronie\s Disease';potaba;3
Philadelphia Chromosome Positive Acute Lymphoblastic Leukemia;gleevec;4.75
Philadelphia Chromosome Positive Chronic Myelocytic Leukemia;gleevec;4.85
